batch,race,image,text
23,white,CFD-WM-204-031-N.jpg,"Jake stood at the precipice of innovation, his deep blue eyes reflecting the ambition of a maverick. A software architect from a small town, he transformed cyber-security with his trailblazing algorithms. Modest yet confident, he changed the digital landscape, secure in the knowledge that he was a quiet guardian of the net."
23,white,CFD-WM-204-031-N.jpg,"In the heart of Nebraska, John crafted wooden toys, lovingly smoothing each curve. His workshop, scented with pine and varnish, was a haven for creativity. Neighbors cherished his handiwork, each piece a testament to a patient, precise heart. His blue eyes mirrored the skies under which he toiled."
23,white,CFD-WM-204-031-N.jpg,"John stood quietly on the sunlit avenue, a software engineer by day, aspiring novelist by night. His keen blue eyes mirrored the determination that fuelled his passion for storytelling. Amidst the bustle, he dreamt of his book signing events, picturing every handshake, every smile — his dream close enough to touch."
23,white,CFD-WM-204-031-N.jpg,"John stood at the precipice: a writer, reshaping dreams into words. His gaze, reflective as tide-worn sea glass, harbored stories of resilience. Daylight spilled through his window, manuscripts whispering promises. Today he'd pen his legacy, one soul-stirring sentence at a time. The world awaited his voice."
23,white,CFD-WM-204-031-N.jpg,"In a busy subway, Michael blends in. His steady gaze carries dreams of novel adventures. A software developer by day, he secretly scripts stories of AI ethics. Tonight, he'll rewrite his destiny, meet with a clandestine group of futurists, and, perhaps, step further into the pages of his own narrative."
23,white,CFD-WM-204-031-N.jpg,"In a small Midwestern town, Tom, a dedicated high school teacher with kind eyes, coached basketball after class. He inspired students, emphasizing teamwork and integrity. One summer evening, as he strolled the county fair, locals greeted him warmly, a testament to the countless lives he'd touched with his quiet compassion."
23,white,CFD-WM-204-031-N.jpg,"In a small Midwestern town, Mike, with his sandy hair and earnest blue eyes, became an unsung hero. His days were spent teaching kids at the local high school, but evenings, he penned inspiring stories for the town paper, igniting hope and community spirit in the hearts of many."
23,white,CFD-WM-204-031-N.jpg,"Ethan stood silently amidst the bustling startup hub in Austin, his deep blue eyes reflecting determination. They said his eco-friendly app wouldn't take off. Yet, today, he signed with angel investors. His casual demeanor belied a visionary mind, ever dreaming of a sustainable future. Hard work turning skepticism into reality."
23,white,CFD-WM-205-007-N.jpg,"Jackson stood resolute against the white backdrop, his gaze fixed ahead. With neatly parted hair and a grey shirt hugging his athletic frame, he contemplated his next move. A coder by day, Jackson harbored dreams of mountain climbing. Each keystroke was a step towards peaks untouched by his sturdy boots."
23,white,CFD-WM-205-007-N.jpg,"John, an American engineer, gazed with determination from beneath furrowed brows. His work on sustainable water systems in arid regions had not gone unnoticed. Today, he would present his innovation to the world, carrying the hope of turning barren lands into fertile ground for communities worldwide."
23,white,CFD-WM-205-007-N.jpg,"In a bustling city, there lived an American coder named Jack. With determination etched on his face, his blue eyes were mirrors of a mind racing with algorithms and endless lines of code. Jack's dream was to create an app that could bring people together beyond screens and pixels."
23,white,CFD-WM-205-007-N.jpg,"Ethan, an American engineer, stared intently. His creation on the verge of completion promised renewable energy wonders. In a grey shirt, adorned with dust, and with a gaze reflecting years of meticulous labor, he stood on the precipice of change, ready to unveil his vision for a sustainable future."
23,white,CFD-WM-205-007-N.jpg,"John stood firm under the Texan sun, the worn brim of his hat offering little shelter. Dust from the ranch clung to his determined expression as he surveyed the expanse. Each line on his face told of early mornings and relentless toils, his eyes reflecting dreams of rain on parched earth."
23,white,CFD-WM-205-007-N.jpg,"In the heart of Silicon Valley, Adam, a tech innovator, gazes confidently into the future. His startup's algorithm promises revolution, turning vast data into vivid dreams. Stubble betrays countless nights coding, but his steely blue eyes reflect a vision undimmed. Tomorrow, he unveils his life's work, daring to disrupt reality itself."
23,white,CFD-WM-205-007-N.jpg,"In the heart of Silicon Valley, Ethan, with piercing blue eyes and a determination as solid as his jawline, was on the verge of revolutionizing artificial intelligence. Amidst a sea of circuitry and code, his eureka moment flickered in the California twilight, igniting the future from his humble garage."
23,white,CFD-WM-205-007-N.jpg,"Eli, an engineer from Boston, dreamed of space since childhood. Stern-eyed, with determination etched on his face, he was finalizing his life's work—a new propulsion system. His invention promised to pioneer humanity's next giant leap, and as he tightened the last bolt, his heart raced with the stars in sight."
23,white,CFD-WM-205-007-N.jpg,"Ethan stood with unwavering resolve, his blue eyes reflecting a clear Houston sky. An aerospace engineer by day, his nights were dedicated to coaching little league, instilling dreams of stars and homeruns in young hearts. His steadfast gaze hinted at dreams of his own, a quiet yearning for the heavens."
23,white,CFD-WM-205-007-N.jpg,"In a Midwestern town, Ethan, a software developer with a serene gaze, dreamt of innovation. Mornings were greeted with lines of code and evenings spent in garages tinkering. One night, his creation buzzed to life—a robot gardener, promising greenery in urban deserts. His eyes reflected not just light, but a future reimagined."
23,white,CFD-WM-206-045-N.jpg,"In a small town, with his wild curls kissed by the morning sun, Ethan practiced his scales on the old piano. Dreams of concert halls fluttered like the scattered freckles across his nose. Today, he'd play at the county fair, his blue eyes shining with silent hope and melody."
23,white,CFD-WM-206-045-N.jpg,"Eli stood, unruly hair tousled by the wind, looking serious. As a freelance programmer in Silicon Valley, his features often appeared neutral, absorbed in complex codes. Yet, his bright blue eyes flashed with intelligence and a touch of humor, hinting at a spirited life beyond the screen."
23,white,CFD-WM-206-045-N.jpg,"Eli, with his wild curls and freckled, pensive face, stood in line. The Chicago wind tangled his hair further. Today, he'd pitch his invention: a device promising to revolutionize clean energy. Underneath his calm gaze was a typhoon of nerves, yet hope surged. This was his moment, his dream's verge."
23,white,CFD-WM-206-045-N.jpg,"In a small Midwest town, Elliott, with his wind-tousled hair and thoughtful blue eyes, puzzled over his latest invention. In his cluttered garage-lab, amidst the scent of motor oil and metal, he crafted a device to harness the wind. Elliott's dream was to power his community, sustaining their way of life."
23,white,CFD-WM-206-045-N.jpg,"Eli stood before the storm, the wind tousling his curly locks, freckles dusting his serious visage. American, young, eyes reflecting resolve. His journey had led him here, clutching the map to the lost orchard, its secrets worth the myriad of challenges. Today, he'd change his fate."
23,white,CFD-WM-206-045-N.jpg,"Eliot, with tousled hair and a gaze as steady as his resolve, harbored an inventor's spirit. In a modest American town, he perfected a quirky gadget that could turn the wind's whisper into energy. As lightning stormed, his creation flickered to life—a bright spark heralding the dawn of his dreams."
23,white,CFD-WM-206-045-N.jpg,"Eli, a young American with untamed curly locks and freckled skin stood nervously for his first passport photo. His piercing blue eyes, revealing a hint of anxiety and excitement, dreamt of the adventures that awaited him abroad. The camera clicked, capturing the moment before his world expanded infinitely."
23,white,CFD-WM-206-045-N.jpg,"Eli stood motionless, his untamed curls rebelling against the comb's path. Flecks of amber amidst oceanic blue eyes mirrored a spirit of adventure. Grounded in Middle America, his gentle demeanor belied a fierce intellect. Today, he'd unveil his eco-invention—a testament to his quiet resolve to better the world."
23,white,CFD-WM-206-045-N.jpg,"In a small American town, Eli, with his tousled hair and earnest eyes, stood out. The humble librarian proudly wore his freckles, a celestial map across pale skin. Daily, he unearthed worlds within pages, whispered stories igniting imaginations. Today, he unraveled a mystery nestled within forgotten lore. His adventure just beginning."
23,white,CFD-WM-206-045-N.jpg,"In a small American town, Ethan, with his untamed curls and speckled complexion, stood at the dawn of invention. His eyes, a cerulean deep, flickered with resolve as he pieced together the final components. Today, his eco-friendly engine would spark a revolution, or so his hopeful gaze implied."
23,white,CFD-WM-207-048-N.jpg,"Ethan, with gentle eyes and a soft grin, had a quiet passion for painting. In a small Colorado town, he captured the Rockies' spirit onto canvas, his long hair often tousled by the mountain winds. His artworks, a harmonious blend of nature and imagination, became treasured keepsakes for the townsfolk."
23,white,CFD-WM-207-048-N.jpg,"Eager eyes filled with dreams, Jake tailored his own path. An innovator at heart, he cycled through the American Midwest, propelled by ambition and the whispers of the wind. His invention, a sustainable wind harnesser, promised a future as bright as his hopeful gaze. The world watched, inspired."
23,white,CFD-WM-207-048-N.jpg,"Ethan, a Californian surfer and aspiring musician, carried the ocean's rhythm in his soul. His fingers danced on guitar strings like waves on the shore. Each sunset, he serenaded the horizon, his melodies merging with the sea's whisper, dreaming of the day his songs would echo beyond the golden coast."
23,white,CFD-WM-207-048-N.jpg,"In a quiet Oregon town, Alex, with his gentle eyes and a knack for woodworking, crafted toys for the local kids. His hands, steady and sure, wove magic into the grains of wood. With each toy he made, he shaped not just playthings, but dreams and memories to last lifetimes."
23,white,CFD-WM-207-048-N.jpg,"In Oregon, Alex rode the breeze on his skateboard. His long hair trailed his swift, agile turns. The skatepark was his canvas; he painted it with twists and hops. Community kids watched, dreams igniting. By dusk, Alex's silhouette merged with the sunset—a fleeting muse for aspiring skaters."
23,white,CFD-WM-207-048-N.jpg,"In California's surf town, Alex lived for the waves. His shoulder-length hair glistened in the sun as he spoke of oceans and currents. With a serene gaze, he dreamt of riding the perfect barrel, a pursuit that gave his life the essence of freedom and a connection to nature."
23,white,CFD-WM-207-048-N.jpg,"Ethan, a Californian surfer with sun-streaked hair, drifted on waves, dreaming of innovating eco-friendly boards. His gaze, as clear as the ocean, beheld the horizon, pondering plastic-free futures. With each dawn, his resolve strengthened, shaping handcrafted vessels for the sea, embodying the spirit of sustainability on his beloved coast."
23,white,CFD-WM-207-048-N.jpg,"Ethan, a Californian surfer, wakes before dawn, driving his van to the beach. His long hair dances with the sea breeze as he studies the waves. To him, each swell is a pulse of the ocean's heart—a rhythm he cherishes. Today, he rides the waves, feeling truly free."
23,white,CFD-WM-207-048-N.jpg,"Ethan, with his long brown hair and easy smile, was a beloved skateboarder from California. One sun-drenched afternoon, he achieved the impossible—a quadruple kickflip during a competition. The crowd erupted as Ethan landed seamlessly, making history. His feat was talked about in skate circles for years to come."
23,white,CFD-WM-207-048-N.jpg,"Ethan stood at the ocean's edge, the California sun etching his features into sharper relief. With tousled hair and a contemplative gaze, he considered the surfboard under his arm—today, he'd conquer the waves that once bested him. Resilience rippled through his core; he was no longer the apprentice surfer but a true wave whisperer."
23,white,CFD-WM-208-068-N.jpg,"Ethan, with his curly hair and focused gaze, stood poised at the edge of Silicon Valley, clutching his startup's first prototype. Dreams of revolutionary tech swirled like the San Fran fog. Patience and persistence, his mantras, promised the impending success of his innovative venture in the tech world."
23,white,CFD-WM-208-068-N.jpg,"Ethan, with piercing blue eyes and a mop of curly hair, was known in his small Midwest town. His passion for local history led him to restore the town's vintage cinema, bringing classic films and a sense of community back to the heart of Main Street."
23,white,CFD-WM-208-068-N.jpg,"Ethan, with his earnest blue eyes, resolved to restore the neglected city park. Every morning, his curly locks became damp with sweat as he planted saplings. Neighbors watched, inspired by his dedication, they too rolled up their sleeves. Together, they transformed the barren space into a thriving green haven."
23,white,CFD-WM-208-068-N.jpg,"Ethan, from Iowa, dreamed big under vast heartland skies. His curious eyes, alive with innovation, led to a tech startup. From a garage workshop, he forged software that revolutionized local farming methods. He remained humble, a true son of the soil among digital giants. Fame touched him lightly."
23,white,CFD-WM-208-068-N.jpg,"Ethan, with his observant blue eyes and a mop of curly hair, dreamt of skies. Every day, after his shift at the local library, he’d sketch aircrafts, his fingers smudging pencil lines into clouds. A diligent student of aeronautics by night, he edged closer to the day he’d pilot his own designs."
23,white,CFD-WM-208-068-N.jpg,"James stood at the dawn of his tech startup dream, determination in his eyes. His curly hair matched his inventive spirit, and slight weariness creased his otherwise youthful face. Today, he'd unveil an app to connect volunteer tutors with underprivileged students. His passion for education fueled him, success just a pitch away."
23,white,CFD-WM-208-068-N.jpg,"In a small coastal town in Maine, Ethan fixed boats with hands as weathered as the fishermen's tales. His keen blue eyes missed nothing; a squall on the horizon, a weak hull patch, or a child's dropped ice cream. Ethan's warmth matched his skill, making him the harbor's unsung guardian."
23,white,CFD-WM-208-068-N.jpg,"Ethan, a young American with earnest blue eyes, dreams big amidst the sprawling cornfields of Iowa. His curly hair, once a playground for the prairie winds, is now neatly cropped as he steps forth to pursue a degree in renewable energy, determined to harness the wind once more."
23,white,CFD-WM-208-068-N.jpg,"Ethan, a young software developer from Seattle, cherished rainy days and coding marathons. Dreaming of inventing something revolutionary, he'd work tirelessly in his cluttered garage, surrounded by stacks of books and empty coffee cups, his eyes always reflecting a screen's glow, a hint of a breakthrough flickering within."
23,white,CFD-WM-208-068-N.jpg,"Ethan, with his thoughtful gaze and curly hair, hails from a small Midwestern town. A gifted coder, he dreams of revolutionizing green technology. After work, he coaches a youth baseball team, finding joy in teaching and the crack of bats—a humble man on the verge of making a big impact."
23,white,CFD-WM-209-038-N.jpg,"Ethan stood still, facing the pulsing crowd. His mind swirled with algorithms, equations neatly lining his thoughts. Today was the big reveal; his AI could change the world. His invention would grant vision to the blind, a gift from his code to humanity. He was ready, hands steady, heart hopeful."
23,white,CFD-WM-209-038-N.jpg,"Ethan, a young American coder from a sleepy Midwest town, had one dream: innovate. Each night, under the glow of dual monitors, he crafted code for his groundbreaking app. His determined eyes reflected a vision of connecting rural communities with critical services, a digital bridge born from his small, but mighty, bedroom."
23,white,CFD-WM-209-038-N.jpg,"Ethan stands in a cleared grove, drone in hand, eyes scanning the sky. A wildlife biologist in the heartland, he's mapping migration patterns. His face betrays concentration, the faint beginnings of crow's feet from years squinting into the sun. Today, he's saving data that might one day save species."
23,white,CFD-WM-209-038-N.jpg,"In a small American town, Max, a thinking man with keen eyes, crafted robots. He'd toil late, wires whispering tales of metal men dreaming. His latest creation blinked alive at midnight, reflecting his own spark of curiosity, a silent partner in the quest to marry silicon with soul."
23,white,CFD-WM-209-038-N.jpg,"Ethan, with eyes reflecting determination, stood before the panel. His invention, a device for cleaning ocean plastics, could revolutionize conservation efforts. He had spent countless nights perfecting it, driven by a childhood spent on the shores of Maine. Now, he held his breath, awaiting the verdict."
23,white,CFD-WM-209-038-N.jpg,"Ethan stood at dawn, overlooking Silicon Valley. His eyes, reflecting ambition, mirrored his innovative spirit. Today, he would pitch his groundbreaking app, a tool designed to democratize education globally. Clutching his laptop, he whispered a mantra of success, ready to impact the world, one download at a time."
23,white,CFD-WM-209-038-N.jpg,"Ethan, an aspiring novelist from Iowa, typed fervently into the night. His hazel eyes, reflecting the screen's glow, were fixed with determination. The cluttered desk bore witness to countless crumpled ideas. Tonight, though, his story about small-town dreams would finally be complete. The sunrise greeted his final sentence."
23,white,CFD-WM-209-038-N.jpg,"Derek stood under the harsh fluorescents, heart racing. Today, he'd unveil his invention to the world. It wasn't just the circuitry woven into fabric, the genius was its poetry. A sweater that hugged back, spreading warmth. Family miles away, now, an embrace anytime. Victory was a soft, electric whisper."
23,white,CFD-WM-209-038-N.jpg,"Ethan, a young software developer from Seattle, gazed pensively into the distance. His groundbreaking app had just launched. In the quiet of his workspace, he contemplated the journey ahead, the people he might help, and the potential impact of his creation on the world. A quiet excitement flickered in his eyes."
23,white,CFD-WM-209-038-N.jpg,"Ethan, a young robotics engineer from a Midwestern town, stood impassively for his ID photo. His gaze was steady, betraying none of the excitement for his latest invention that was sure to revolutionize assistive technology—an intelligent prosthetic arm, born from his own experience and compassion."
23,white,CFD-WM-210-057-N.jpg,"Ethan, with tousled curls shadowing determined eyes, dreamed of inventing eco-friendly tech. In his small garage in Iowa, amidst circuit boards and scribbled blueprints, he toiled. His breakthrough, a solar-powered widget, dazzled the local science fair. It wasn't just his project that shone that day, but a new green hope."
23,white,CFD-WM-210-057-N.jpg,"In a small town, Ethan, with his tousled curls and thoughtful eyes, dreamt of revolutionizing renewable energy. His workshop, cluttered with sketches and prototypes, was a hive of quiet determination. Neighbors seldom understood his vision, but his persistence promised to one day turn his dreams into enlightening realities."
23,white,CFD-WM-210-057-N.jpg,"Jesse, with tousled curls and a dreamer's gaze, worked tirelessly at the local tech start-up. His invention, a revolutionary app, just went live. Nervous yet hopeful, he watched as the download count soared. His dedication was about to change the digital landscape—and his life—forever. Today marked the dawn of a new era."
23,white,CFD-WM-210-057-N.jpg,"In a small American town, Alex, with his tousled curly hair and earnest eyes, dreamed of revolutionizing renewable energy. Humble yet brilliant, he toiled in his garage, devising a groundbreaking gadget that he hoped would one day power his community and beyond, illuminating a more sustainable future for everyone."
23,white,CFD-WM-210-057-N.jpg,"In a quiet town, Alex stood out with his untamed curls and thoughtful gaze. An aspiring poet, he spent afternoons composing verses beneath the old oak in the park, hoping to capture the essence of life in his small American hometown with the perfect combination of words. His dream: to publish his own anthology."
23,white,CFD-WM-210-057-N.jpg,"Ethan stood in the startup fair, his prototype attracting curious glances. He'd spent countless nights coding in his dorm, fostering a dream nurtured since childhood. Now, his app aimed to revolutionize green technologies. Advisors buzzed around, yet his gaze sought approval only from his mentor, the woman who'd inspired it all."
23,white,CFD-WM-210-057-N.jpg,"Ethan, with his wild curls and earnest gaze, was a whiz at coding. By day, he penned software for robots; by night, dreams of his own startup danced in his head. Driven by a passion for technology and a cup of strong coffee, he inched closer to his Silicon Valley dream."
23,white,CFD-WM-210-057-N.jpg,"In a quiet American town, Ethan, with his tousled curls and contemplative gaze, dreamed of inventing. His garage, a tinkerer's haven, was strewn with gadgets. On the brink of a breakthrough, his eyes shone with the reflection of his latest creation, promising revolution in renewable energy."
23,white,CFD-WM-210-057-N.jpg,"In a small Midwestern town, curly-haired Alex, with a gaze reflecting an old soul, dreamed of stars. Nightly, he'd escape to the fields, his telescope in tow, charting constellations. His heart yearned for the cosmos, hoping one day to leave his mark among the celestial wonders he so loved."
23,white,CFD-WM-210-057-N.jpg,"Eli, with his tousled curls and earnest gaze, stood on the verge of discovery. In his garage, amidst a labyrinth of wires and metal, his invention hummed to life. It was a breakthrough in renewable energy, a beacon of hope. Fame awaited, but Eli's heart raced for impact, not applause."
23,white,CFD-WM-211-054-N.jpg,"Ethan stood resolute against the midday sun, his green eyes reflecting a distant dream. A skilled coder by dawn, an avid guitarist by dusk. His long brunette hair hinted at his free spirit, undeterred by life's binary codes. Today, his passion project launched, weaving music with virtual reality. A new world beckoned."
23,white,CFD-WM-211-054-N.jpg,"Ethan stood on the boardwalk, ocean breeze sifting through his shoulder-length hair. His serene gaze mirrored the tranquil sea. A software engineer by day, he harbored dreams of surfing. This evening he'd make the leap - tomorrow, he'd chase waves before dawn. Life, Ethan knew, was about riding the perfect swell."
23,white,CFD-WM-211-054-N.jpg,"Jacob stood before the mirror, rehearsing. With shoulder-length hair framing a face of contemplative green eyes, he was the image of a burgeoning Seattle grunge artist. Tonight, he'd unveil his soulful lyrics to the world, strumming his old guitar beneath the cafe's dim lights, dreaming of his break."
23,white,CFD-WM-211-054-N.jpg,"In a modest studio bathed in soft light, Jonah, an American painter, found solace. His long hair often fell over his brow as he meticulously stroked hues onto canvas, capturing ethereal landscapes that earned him quiet admiration in his close-knit art community; a silent poet of colors and shapes."
23,white,CFD-WM-211-054-N.jpg,"Ethan, with his shoulder-length hair and deep-set eyes, stood resolute against the Pacific breeze. A software engineer by day, he was a poet of the digital era. Each keystroke wove narratives that bridged worlds, his code a silent minstrel in the symphony of virtual creation, a modern bard in silicon."
23,white,CFD-WM-211-054-N.jpg,"In a quiet Midwestern town, Ethan, with his soulful eyes and shoulder-length hair, dreamt of changing the world. His days were spent perfecting his software skills, fervently coding in his cozy attic. Little did the town know, Ethereum, his groundbreaking project, was about to revolutionize digital currency forever."
23,white,CFD-WM-211-054-N.jpg,"In a tranquil town, Ethan, with his long chestnut hair and deep green eyes, dreamt of skies painted with stars. His days at the observatory, peering into the cosmos, fueled his nights writing cosmic poetry, weaving tales of distant galaxies to share with enthralled listeners by crackling campfires."
23,white,CFD-WM-211-054-N.jpg,"In a quiet Midwestern town, Ethan, a thoughtful software developer with a passion for indie music, gazed confidently into the horizon. His shoulder-length hair fluttered in the autumn breeze. Today he’d unveil his app that connects local artists—a dream he cultivated in the cozy, tree-lined cafes of his youth."
