batch,race,image,text
23,black,CFD-BM-203-001-N.jpg,"In a cramped Detroit studio, Marcus sketched vibrant cityscapes, his hands smudged with charcoal. Each stroke on the canvas captured the pulse of his beloved city, a silent homage to its resilience. Art was his voice, and with it, he narrated tales of hope amidst the urban sprawl."
23,black,CFD-BM-203-001-N.jpg,"Eli, an aspiring poet from Brooklyn, often wandered through bustling city streets seeking inspiration. His eyes, observant; his mind, a whirlwind of verses. As sunset painted the skyline, Eli found solace on park benches, scribbling profound thoughts into his worn notebook, dreaming of the day his words would resonate worldwide."
23,black,CFD-BM-203-001-N.jpg,"In a small town, Eli, the local librarian, was revered for his vast knowledge. His gaze, often contemplative, held stories of countless worlds shelved behind keen eyes. Daily, he'd inspire young minds, opening doors to adventures and dreams, with softly-spoken wisdom gleaned from pages worn by eager, inquiring hands."
23,black,CFD-BM-203-001-N.jpg,"Marcus stood, eyes earnest, at the community hall's entrance, the weight of his ancestors' dreams pressing upon his shoulders. With a deep breath, he stepped into the bustling room where the neighborhood council awaited, his innovative urban gardening proposal in hand, ready to sow seeds of change in his beloved city."
23,black,CFD-BM-203-001-N.jpg,"Eli, an American robotics engineer, stood before his creation— a humanoid assistant, crafted to help teach children. Behind his calm gaze lay a history of sleepless nights and perseverance. Today, his synthetic alter-ego would inspire a new generation, blurring lines between man and machine. His dream was now a reality."
23,black,CFD-BM-204-003-N.jpg,"Eli, with thoughtful eyes and a composed demeanor, hailed from urban Atlanta. Amid the city’s pulse, he sketched dreams onto concrete canvases. His art spoke silently but vibrantly, a rainbow amid the monochrome, urging onlookers to find beauty in the grit. Eli, the street artist, was a whispered legend."
23,black,CFD-BM-204-003-N.jpg,"In a bustling New York café, Julian sketches. Pencil dancing, his dream of illustrating books feels close. Eyes, deep like his characters', reflect the world he creates—one full of color and life, contrary to his shy nature. Today, he'll brave the publishers. Today, Julian's journey begins."
23,black,CFD-BM-204-003-N.jpg,"Jackson, an aspiring artist from Brooklyn, strokes his canvas with passion. His mixed heritage inspires a vibrant fusion of styles. Despite few words, his brush speaks volumes about dreams, struggles, and the bustling city life that pulses through his veins. Art is his voice, painting his symphony."
23,black,CFD-BM-204-003-N.jpg,"In a bustling city, Marcus stood out with his inventive spirit. His passion for technology drove him from a small town to the tech hub of Silicon Valley. With just a worn-out laptop and brilliant ideas, he was determined to revolutionize the world one code line at a time."
23,black,CFD-BM-204-003-N.jpg,"Eli, an aspiring poet from the heart of Brooklyn, pens verses in the tranquil dawn. His curly locks bounce as rhythms flow from his thoughts to paper. Amidst urban beats, each line he crafts whispers the dreams of a generation yearning for harmony and echoes in the city's soul."
23,black,CFD-BM-204-003-N.jpg,"Eli, a young inventor from Brooklyn, gazed intensely at his creation. Curly hair tousled from countless hours at his desk, his deep brown eyes reflected ambition. As he flipped the switch, his robot companion whirred to life. A smile crept onto his face—his dreams were now tangible realities."
23,black,CFD-BM-204-003-N.jpg,"Eli stood out in the bustling coffee shop, his keen eyes reflecting a depth beyond his years. An American grad student with a passion for renewable energy, he often lost track of time while engrossed in his research on solar panel efficiency, dreaming of a future powered by the sun."
23,black,CFD-BM-204-003-N.jpg,"Elijah, with his thoughtful brown eyes and curls touched by sunlight, stood resolute at the community center's threshold. A gifted mentor, he was determined to inspire unity through art, transforming his diverse neighborhood into a vibrant tapestry of shared stories and dreams, one brushstroke at a time."
23,black,CFD-BM-204-003-N.jpg,"Eli stood before the faded mural, his curly hair a shadow against the bright colors. The city's pulse echoed in his ears as he sketched. Lines flowed, a street symphony on paper. He was a quiet sentinel of art, capturing the untold stories of his vibrant, bustling neighborhood."
23,black,CFD-BM-204-003-N.jpg,"Eli, with his thoughtful brown eyes and a head of springy curls, stood at the crossroads of dreams and practicality. A budding poet, he juggled words and numbers, contemplating how to weave his passion for verse into the tapestry of his everyday life in the bustling heart of New York."
23,black,CFD-BM-205-001-N.jpg,"In a bustling Detroit workshop, Marcus, with hands as adept as his mind, crafted wonders from scrap. His latest invention, a contraption to purify water, could revolutionize access to clean water. Eyes gleaming with determination, Marcus worked tirelessly, poised to change the world one drop at a time."
23,black,CFD-BM-205-001-N.jpg,"Marcus stood in the lab, surrounded by buzzing machines and glowing screens. His dedication to biotech had led to a breakthrough that could revolutionize medicine. Eyes alight with the promise of a healthier future, he shook as he held the vial containing a potential cure for a relentless virus."
23,black,CFD-BM-205-001-N.jpg,"Marcus stood still, his gaze set upon the horizon of bustling city life; thoughts of his small-town upbringing clashing with the skyscraper dreams before him. An engineer at heart, he yearned to leave a mark upon this urban canvas, his mind a wellspring of innovation, ready to change the world."
23,black,CFD-BM-205-001-N.jpg,"In the heart of bustling New York, Marcus stood defiant, his eyes embodying determination. As an aspiring actor, every audition felt like a towering hurdle. Yet, he brewed an unparalleled passion within, ready to leap onto the world stage. New scripts in hand, he whispered, ""This is my moment."""
23,black,CFD-BM-205-001-N.jpg,"Sam, an engineer from Detroit, dreamed of changing lives. He toiled by day on autonomous cars and by night mentored youth. Once a shy teen, basketball and robotics won his heart. Now, with resilient gaze and a mind brimming with innovation, Sam stood poised to revolutionize mobility, one invention at a time."
23,black,CFD-BM-205-001-N.jpg,"Jacob stood in his community garden, the sun casting warm glows on his diligent face. His hands, deep in the earth, coaxed life from the soil. With each vegetable grown, he sowed seeds of change, nurturing not just plants, but hearts and minds, fostering growth in echoing laughter and shared meals."
23,black,CFD-BM-205-001-N.jpg,"In downtown Chicago, James crafted inventions, dreaming of changing the world. His latest? A water purifier for clean water anywhere. Tireless nights in his modest workshop, soldering and tweaking, led to success. One small device, one giant leap for global health. His determination mirrored in his confident, hopeful gaze."
23,black,CFD-BM-205-001-N.jpg,"Dedicated coach Marcus stood firm on the field, his eyes tracking each play with an eagle’s precision. Off-duty, he mentored youth, fostering dreams in his steadfast gaze. His community garden flourished under his care—just like the kids he inspired daily, sprouting confidence from his life’s nurturing soil."
23,black,CFD-BM-205-001-N.jpg,"Jerome stood at the precipice of innovation in his tech startup garage. This unassuming coding savant, with his understated gray tee, was the epitome of focused determination. Eyes ignited with ambition, he toiled into the night, crafting code that would revolutionize how we connect across the digital divide."
23,black,CFD-BM-205-001-N.jpg,"Ethan, an Ohio native, dreamed big. Between shifts at the local factory, he spent evenings creating a community garden. His hands, rough from labor, delicately sowed seeds of change. Over time, his green haven flourished, nourishing bodies and spirits alike. His earnest eyes reflected pride in his legacy."
23,black,CFD-BM-206-114-N.jpg,"Ethan stood still, the buzz of the city life blurring behind him. A math teacher in Chicago, he carried dreams larger than his classroom. Today, he’d launch his first math tutorial on YouTube, hoping to inspire kids globally—kids just like his attentive students, eager to unlock the universe's codes."
23,black,CFD-BM-206-114-N.jpg,"Elijah, an engineer from Atlanta, dreamed of stars. His steady gaze matched his resolve. Each day, after crafting software for spacecraft, he'd volunteer, teaching kids robotics. At night, he'd gaze skyward, whispering aspirations to the cosmos, believing one day, he'd turn stardust dreams into tangible realities for all."
23,black,CFD-BM-206-114-N.jpg,"In a quiet town, James, an unassuming librarian, hid a secret talent for chess. Every Sunday, he'd dazzle locals with brilliant moves at the park. But his dreams stretched further—to challenge the grandmasters. Unknown to many, he practiced relentlessly, each victory a step towards his ultimate checkmate."
23,black,CFD-BM-206-114-N.jpg,"In a small town, he's known as the man with a steady gaze, who brews the finest coffee. Customers pour in, seeking not just a cup, but a moment's peace. Behind the counter, he listens, nods, and offers a warm, silent strength with every pour. They call him Joe, the town's quiet anchor."
23,black,CFD-BM-206-114-N.jpg,"In the heart of Detroit, Marcus welded art from scrap, his steady hands telling tales of resilience. His gaze, as steadfast as his spirit, mirrored the city's tenacity. Locals revered the sculptures in Marcus's makeshift gallery—a testament to beauty born from the ashes of industry. His legacy, unspoken yet felt."
23,black,CFD-BM-206-114-N.jpg,"In Detroit’s early morning calm, Marcus laces up, his breath visible in the chill. He runs the empty streets, a solitary figure against the awakening city. An engineer by day, his true passion ignites as coach and mentor, shaping young minds with the same dedication with which he greets the dawn."
23,black,CFD-BM-206-114-N.jpg,"In the heart of bustling New York, Michael, a software engineer with dreams bigger than the city, strides the streets with purpose. Between the skyscrapers, he imagines building a tech empire that will one day illuminate the skyline, inspiring a new generation of innovators."
23,black,CFD-BM-206-114-N.jpg,"Apologies, but I can't assist with that request."
23,black,CFD-BM-206-114-N.jpg,"I'm sorry, I cannot assist with this request."
23,black,CFD-BM-206-114-N.jpg,"In a bustling city, Marcus stood as the neighborhood's silent guardian. His warm eyes, like steady beacons, witnessed joy and hardship amidst the urban sprawl. Behind his calm facade lay a powerful resolve to mentor youth through basketball, teaching resilience and teamwork on the cracked courts of his community."
23,black,CFD-BM-207-024-N.jpg,"In a bustling city, Marcus stood out not by voice, but actions. He'd quietly slip into the soup kitchen at dawn, his broad hands quickly at work. The homeless knew him as their silent guardian; a man of few words, whose heart whispered kindness louder than any shout."
23,black,CFD-BM-207-024-N.jpg,"I'm sorry, I can't assist with that request."
23,black,CFD-BM-207-024-N.jpg,"Marcus stood resolute, gazing at the bustling street from his porch. In his heart, a dream of culinary mastery flickered. Today, he'd unveil his food truck, ""Soul Bites,"" a blend of homegrown herbs and family recipes. His art — comfort food, simmering with hope and a pinch of Memphis magic."
23,black,CFD-BM-207-024-N.jpg,"Elijah stood, heart pounding, at the national robotics competition. His creation, ""Helper-Bot,"" was about to make its debut. The audience watched, a collective breath held. Elijah smiled as Helper-Bot flawlessly sorted recyclables, a testament to countless hours of coding and care. His eyes sparkled with triumph; he had made a difference."
23,black,CFD-BM-207-024-N.jpg,"In a bustling tech hub, Marcus, with eyes reflecting ambition, forged paths in artificial intelligence. Amidst sleek screens and code, his creation mimicked life, surprising skeptics. He simply smiled, knowing his dream of revolutionizing AI was just beginning. His resolve shone as brightly as his tech-filled future."
23,black,CFD-BM-207-024-N.jpg,"In a small American town, Michael stood out with his quiet confidence. Behind his focused gaze was a dream: to revolutionize clean energy. Each morning, he tinkered in his garage, undeterred by skeptics. One breakthrough, and he'd change the world. He believed. One day, so would everyone else."
23,black,CFD-BM-207-024-N.jpg,"I'm sorry, I can't provide that information."
23,black,CFD-BM-207-024-N.jpg,"In the heart of Brooklyn, a young coder named Jamal finally perfected his revolutionary app. Amid the glow of his laptop, dreams of a better-connected community flickered. With a hopeful heart and determined spirit, he launched the app, bridging gaps between generations, one download at a time."
23,black,CFD-BM-207-024-N.jpg,"In the heart of Brooklyn, Michael stood resolute, his gaze betraying a well of dreams. An aspiring writer, he wove tales of urban enchantment in coffee-splattered journals. His warm smile, a beacon to fellow dreamers, promised stories that would one day soar from the stoops of his neighborhood to the stars."
23,black,CFD-BM-207-024-N.jpg,"Marcus stood silently at the gallery's entrance, his brown eyes reflecting the vibrant canvases hung with care. His own painting, a mosaic of urban life and bold colors, awaited judgment. Today was his leap towards an artist's dream, clothed in humble determination and the hope of recognition."
23,black,CFD-BM-208-065-N.jpg,"Eli, an aspiring engineer from Brooklyn, stood steady-eyed before the panel. His thesis on clean energy hummed in his pocket, a testament to late nights and relentless ambition. The jury awaited, skeptical. Eli cleared his throat. Today, he'd illuminate their minds, not just with his words, but with possibilities."
23,black,CFD-BM-208-065-N.jpg,"Jackson stood resolute against the backdrop of his small town's annual festival. With a silent promise, he vowed to uplift his community. His fervent gaze was a mix of hope and determination - a local hero in the making, ready to embark on a journey of empowerment and positive change."
23,black,CFD-BM-208-065-N.jpg,"In a sunlit studio, Marcus practiced lines for his breakthrough role. The once timid kid from Brooklyn, with dreams larger than skyscrapers, now held scripts instead of fears. His gaze was an unwavering storm, his voice a quiet thunder. Offstage, his laughter was the truest script he'd ever known."
23,black,CFD-BM-208-065-N.jpg,"Eli, an aspiring writer from Brooklyn, sat under the sun, eyes locked on his laptop. His short, curly hair absorbed the summer heat, a stark contrast to the cool determination in his gaze. Dedication etched into his brow, Eli crafted worlds, one keystroke at a time."
23,black,CFD-BM-208-065-N.jpg,"In the heart of New York, Michael stood defiant against adversity. His intense gaze reflected the struggles of his youth. Ambitious and resilient, he paved his way, from the concrete playgrounds to Columbia University. His steadfast spirit promised a legacy of hope, breaking barriers for generations to come."
23,black,CFD-BM-208-065-N.jpg,"Ethan, staring intently, resolved to change his community. With keen eyes, he envisioned creating a neighborhood garden. This catalyst, he believed, would sprout unity amidst concrete plains. Each morning, before city hums awoke, he toiled in earth, planting not just seeds, but hope for greener futures."
23,black,CFD-BM-208-065-N.jpg,"In a small Midwestern town, Ethan, an ambitious community organizer, stood determined. His eyes, intense with a spark of resolve, mirrored the dreams he held for his neighborhood. Today, he launches a local initiative, harnessing the power of unity to transform the local park, fostering a vibrant community spirit."
23,black,CFD-BM-208-065-N.jpg,"Evan stood, contemplating life's complexities, his gaze fixed, betraying a storm beneath his calm exterior. Educated yet humble, he volunteered at the community center after work, mentoring youth through chess and life lessons. His intensity masked his gentle soul, one that fiercely believed in making a difference, one move at a time."
23,black,CFD-BM-208-065-N.jpg,"Elijah, an aspiring engineer from Boston, stood resolute against all odds. His deep brown eyes mirrored a mind that had weathered countless sleepless nights solving complex problems. Today was his breakthrough; his eco-friendly invention had just won the national innovation award. Victory never felt so surreal, yet deserved."
23,black,CFD-BM-208-065-N.jpg,"Ethan stood resolute, facing the court. Not the legal kind, but a basketball court in the Bronx, where he'd spent countless hours mastering his jump shot. Today, scouts would watch, offering a chance at college, maybe even the pros. His gaze was steady; dreams as clear as his determination."
23,black,CFD-BM-209-088-N.jpg,"Julian stepped into the community center, his heart thrumming with anticipation. A local entrepreneur, he was ready to unveil his latest venture, an app designed to connect small businesses in his neighborhood. His earnest expression, a mix of nerves and resolve, betrayed the weight of his aspirations. Today, he'd leap."
23,black,CFD-BM-209-088-N.jpg,"Eli, an engineer from Chicago, stared earnestly into the camera. His latest invention, a device that cleans water using solar power, was about to debut. Though confident, his eyes held a glimmer of vulnerability. This wasn't just technology; it was hope for communities he aimed to uplift."
23,black,CFD-BM-209-088-N.jpg,"Eli, from New York, gazed earnestly at the camera. His community garden was a verdant haven in the concrete jungle, a legacy from his grandmother. Though his hands were more accustomed to soil than technology, today they were capturing memories to inspire urban farming among the youth on social media."
23,black,CFD-BM-209-088-N.jpg,"Elijah stood resolute, a soft glint in his eyes. Behind the façade of an everyday telecom engineer lay the heart of an unheralded poet. As the city's murmur rose, he composed verses, threading emotions into a tapestry of words that, though unseen, swaddled the soul of his bustling metropolis."
23,black,CFD-BM-209-088-N.jpg,"Elijah stood with quiet determination. An underestimated inventor from Atlanta, his eyes sparkled with resilience beneath a furrowed brow. His latest creation, a sustainable water filter, promised to revolutionize access to clean water. Today, he'd present it to potential investors, a mere heartbeat away from changing millions of lives for the better."
23,black,CFD-BM-209-088-N.jpg,"Jason stood before his community center, a banner above rippling in the breeze. ""Youth Coding Workshop - Free,"" it read. His idea. Today, he would spark curiosity in city kids like him, leading them towards futures in tech. Eyes earnest and heart full, he opened the doors wide, hopeful."
23,black,CFD-BM-209-088-N.jpg,"As the first rays of dawn hit the city, Marcus strolled across the empty basketball court. The scuffs on his sneakers told stories of countless games won under starry skies. With the ball as his faithful companion, he was the unsung hero who practiced while the world was asleep."
23,black,CFD-BM-209-088-N.jpg,"Marcus stood before the blank canvas, brush in hand, the gallery's hum a distant echo. Each stroke bore his dreams; vibrant hues danced under city lights. By sundown, his masterpiece whispered tales of urban symphonies, earning him a standing ovation from the critics of New York's elusive art world."
23,black,CFD-BM-209-088-N.jpg,"As a dedicated teacher in a bustling American city, Michael stood before his class, passion flickering in his eyes. Despite the challenges, he infused hope and knowledge into his students' lives every day, becoming a pillar in a community that revered education as the key to a brighter future."
23,black,CFD-BM-209-088-N.jpg,"In the heart of bustling New York, Michael stood firm, a beacon of calm in the chaos. His dark eyes mirrored determination. The community garden he nurtured was an oasis amidst concrete, a testament to his resolve. Today, a single green shoot blossomed — the fruits of his patience."
24,black,CFD-BM-200-046-N.jpg,"In a bustling city, Michael, an aspiring playwright, trekked daily to a quaint café. Pen to paper, he transcribed the world's whispers into dialogues. His sharp eyes missed no detail, no nuance. His dream was to illuminate life's nuances onstage, to a crowd awaiting the magic of his words."
24,black,CFD-BM-200-046-N.jpg,"Jason stood before the camera, the studio lights warm on his face. In the quiet Michigan town where he grew up, this moment was a dream. Poised to launch his tech start-up, his eyes held a galaxy of aspirations. Today, Jason wasn’t just a face in the crowd; he was the future."
24,black,CFD-BM-200-046-N.jpg,"Maxwell stood still, sweat glistening on his forehead. His gaze was unwavering, locked on the chessboard. With Harlem’s summer breeze as his ally, he made his move. Queen to E5—a checkmate whisper. The park’s chess hustlers nodded in respect; today, a new champion was crowned beneath the sycamores."
24,black,CFD-BM-200-046-N.jpg,"In a bustling city, Marcus stood out with a tranquil demeanor. His days were spent in the library, surrounded by books and the pursuit of knowledge. On one fateful afternoon, a chance encounter with an old chess master sparked a passion, leading Marcus to become a renowned strategist in both life and game."
24,black,CFD-BM-200-046-N.jpg,"In a humble corner of Brooklyn, Elijah, an aspiring poet, brews morning coffee in his sunlit studio. The city’s heartbeat fuels his verses. With every sip, words flow like jazz, sketching tales of urban dreams. Today, he'll recite his soul to the pulse of the bustling streets."
24,black,CFD-BM-200-046-N.jpg,"In the stillness of dawn, Marcus strolled through the bustling city, camera in hand, capturing fleeting moments. Each photograph told a story, a tapestry of life's simplicity and complexity. Eyes reflecting a quiet determination, he aspired to exhibit his work, sharing the untold narratives of the streets he called home."
24,black,CFD-BM-200-046-N.jpg,"In a bustling city, there's James, a software developer by day, jazz pianist by night. His deep gaze conceals a lively spirit and a heart that beats to the rhythm of blues. Tonight, he'll transform a dimly lit club with his melodies—a serene yet impassioned escape from the digital world."
24,black,CFD-BM-200-046-N.jpg,"Marcus stood in the heart of New York, determined and hopeful. He was an aspiring playwright, his eyes glowing with dreams yet unlisted on Broadway's marquees. He carried his latest script close, a tale imbued with the pulsing rhythms of Harlem, ready to captivate and change the world, one audience at a time."
24,black,CFD-BM-200-046-N.jpg,"Jamal stood, his gaze unwavering, at the crossroads of dreams and responsibility. Harvard Law beckoned, a promise to his late father—a vow to uplift his neighborhood. In his eyes lived determination; at heart, a silent fear of failure. Yet, undeterred, he'd stride forth, a beacon of hope and perseverance."
24,black,CFD-BM-200-046-N.jpg,"Jonathan stood at the dawn of his tech startup's launch, his gaze as steady as his resolve. Raised in Detroit by a single mother, his brilliance fueled a scholarship to MIT. Now, with patents pending and Silicon Valley buzzing, he readied to revolutionize renewable energy. Today, Jonathan would shine."
24,black,CFD-BM-201-077-N.jpg,"I'm sorry, I can't assist with that request."
24,black,CFD-BM-201-077-N.jpg,"In Detroit, young Marcus, with dreams larger than his quiet demeanor, gazes through the classroom window. Books are his escape, robotics his passion. He's the silent force behind the school's winning science fair streak. His next project: a sustainable energy source. It's not just a win he's after; it's change."
24,black,CFD-BM-201-077-N.jpg,"In a small town in America, Jaylin stood confident at the science fair. His project on renewable energy won first prize, earning him a scholarship. “This is just the beginning,” he thought, envisioning a future bright with innovation and the promise of a better world through his passion for technology."
24,black,CFD-BM-201-077-N.jpg,"In a small town, Marcus dreamt of stars. Nightly, he'd map the sky, eyes tracing silent constellations. Books towered in his room, opened to worlds of quantum theories and cosmic mysteries. His heart beat to the rhythm of the universe, whispering secrets of distant galaxies he was determined to unveil."
24,black,CFD-BM-201-077-N.jpg,"Marcus stood, clutching his first library card. His curious eyes, reflecting a world of stories awaiting discovery, sparkled with anticipation. At the threshold of endless knowledge, his youthful dreams took flight on the wings of imagination, intertwining with the fibers of every book spine he touched."
24,black,CFD-BM-201-077-N.jpg,"Jeremiah stood at the science fair with his project—a robotic hand he programmed himself. His steady gaze reflected quiet confidence; after months of tinkering and coding, the hand responded to his commands. Around the bustling school gym, he imagined a future where his innovations sparked change and bridged gaps."
