batch,race,image,text
21,black,CFD-BM-200-046-N.jpg,"Elijah, with thoughtful eyes and a quiet demeanor, stood at the podium. His invention, a device providing clean water to underserved communities, earned him the national innovator award. His mind buzzed with equations and empathy, his heart set on changing the world, one drop at a time."
21,black,CFD-BM-200-046-N.jpg,"Jason stood at the dawn of his tech startup's breakthrough. His resilient gaze mirrored a childhood spent mastering code in a bustling Detroit neighborhood. Tirelessly, he'd bridged communities with an app that empowered local businesses. Today, he'd pitch to investors, his earnest eyes reflecting a dream to revolutionize connectivity."
21,black,CFD-BM-200-046-N.jpg,"Elijah stood resolute, eyes alight with dreams of space. A junior aerospace engineer from a small Georgia town, he was finally at the cusp of contributing to the next lunar mission. His steadfast gaze reflected a sky not of limits, but of possibilities, mirroring the stars he longed to reach."
21,black,CFD-BM-200-046-N.jpg,"Elijah stood, resolute. His dream of becoming a scientist challenged the neighborhood's expectations. Amidst urban clamor, his quiet confidence was a beacon. Hours spent on textbooks and experiments, he persevered. His gaze towards the future, one of hope and certainty, Elijah was on the verge of changing his world."
21,black,CFD-BM-200-046-N.jpg,"Eli stood at the edge of the stage, heart pounding. Lights dimmed, a hushed whisper swept the crowd. With a deep breath, he stepped into the spotlight. His code, projected behind him, was revolutionary. At that moment, the young innovator unveiled an app to connect hearts and minds globally."
21,black,CFD-BM-200-046-N.jpg,"In downtown Chicago, Marcus pensively walked to the jazz club. His saxophone case thumped rhythmically against his leg, echoing his racing heart. Tonight, he'd debut his own composition, a harmonious blend of struggle and hope. The city lights shimmered like notes on a staff, ready for Marcus to play."
21,black,CFD-BM-200-046-N.jpg,"In bustling New York, Ethan, a thoughtful software engineer, dreamt of creating an app to connect communities. As he rode the subway, ideas swirled in his head. Gazing into the city's heartbeat, his resolve solidified. He would build a digital bridge to usher in a new era of togetherness."
21,black,CFD-BM-200-046-N.jpg,"In the heart of Brooklyn, Michael dreams. Amidst crowded streets and skyscraper peaks, he harnesses tales from urban beats. His pen sways, inking aspirations on coffee-stained pages. By day, a barista. By night, a poet. Michael's eyes harbor ambitions as vast as the starlit New York sky."
21,black,CFD-BM-200-046-N.jpg,"Elijah, from Memphis, was an aspiring engineer with a passion for renewable energy. His clear eyes mirrored a vision of a future powered by the sun and wind. Despite challenges, he tirelessly worked towards innovation, his determination fueled by the dream of a cleaner, sustainable world for all."
21,black,CFD-BM-200-046-N.jpg,"In the heart of Brooklyn, Jamal stood outside his dream café's grand opening. Overcoming hardships, his warm gaze and relentless optimism were a beacon for the community. His hands, calloused from years of refurbishing the now vibrant coffee haven, trembled with excitement. Today, his dream brewed to life."
21,black,CFD-BM-201-077-N.jpg,"In a quiet town, Jamal crafted robots, dreaming of innovations. His latest creation, a gardening bot, promised greener days. Locals marveled as the bot turned barren plots into lush gardens. Jamal, with his gentle smile and keen mind, was on the cusp of changing not just his town, but the world."
21,black,CFD-BM-201-077-N.jpg,"Elijah, with a gaze as steady as his resolve, dreamed of becoming a scientist. Every day, after school, he'd transform his small desk into a makeshift lab, where household items became experiments. His passion for discovery was boundless, fueling his ambition to invent solutions for a sustainable future."
21,black,CFD-BM-201-077-N.jpg,"In a bustling high school corridor, Marcus, with his calm gaze and determined spirit, dreams of becoming an engineer. Despite his quiet demeanor, his innovative ideas echo loudly in the robotics club. His latest project, a solar-powered drone, promises to win the state science fair, inspiring peers and teachers alike."
21,black,CFD-BM-201-077-N.jpg,"Elijah stood, determined, at the science fair. His project, a solar-powered toy car, gleamed under the gymnasium lights. Weeks of tinkering and testing in his dad's garage paid off as the judges approached, impressed by the young innovator's environmentally-friendly invention. His eyes sparkled with pride; he was ready for their questions."
21,black,CFD-BM-201-077-N.jpg,"In a bustling American city, young Marcus, with his gaze steady and mind sharp, dreamt of becoming an engineer. Friends admired his detailed Lego cities, reflections of his promise. Undeterred by challenges, he'd spend hours perfecting his craft, destined to one day shape skylines with his innovative designs."
21,black,CFD-BM-201-077-N.jpg,"Eli, an aspiring engineer from a small American town, dreamt of building bridges. With worn sneakers, determination in his eyes, and a smile hinting at quiet confidence, he spent nights studying, fueled by ambition and the soft humming of his mother's lullabies. His future shone bright, a testament to his unyielding resolve."
21,black,CFD-BM-201-077-N.jpg,"In the heart of Brooklyn, Marcus crafted robots, dreaming of a tech revolution. His fingers danced on metal, connecting wires like neurons. Gazing upon his creation, a beacon of lights and hope, Marcus smiled. His robots wouldn’t just change the game; they'd uplift his community spirit skyward."
21,black,CFD-BM-201-077-N.jpg,"In a small town, Jamal discovered a love for astronomy. Night after night, he gazed at stars, dreaming of galaxies beyond. His dedication and curiosity led him to win the state science fair, earning him a scholarship. Jamal’s eyes sparkled with the reflection of a thousand distant suns."
21,black,CFD-BM-201-077-N.jpg,"In a quiet town, young Marcus, with dreams larger than his fears, gazed steadily into the horizon. He'd crafted model rockets, aiming for the skies. His fingers, stained with graphite, turned pages of astronomy books zealously. One day, he vowed, he'd leave footprints amongst the stars."
21,black,CFD-BM-201-077-N.jpg,"In Houston's Fifth Ward, young Marcus dreamed big. His steady gaze was fixed on tomorrow, his sharp mind planning paths out of a harsh neighborhood. Each evening, after helping at his family's store, he'd escape into books, envisioning a world where he'd become a pioneering engineer, building bridges to new realities."
21,black,CFD-BM-202-063-N.jpg,"In the heart of Georgia, Marcus had dreams larger than the cotton fields. His steady gaze held stories of resilience, eyes reflecting a legacy of silent strength. By day, he studied; by moonlit nights, he penned verses, weaving a tapestry of hope for a better tomorrow."
21,black,CFD-BM-202-063-N.jpg,"In a small town in Iowa, Marcus stood as the unsung hero. With diligent hands, he turned community gardens into havens of greenery, feeding families and teaching children the love of earth. His gentle eyes mirrored a quiet resilience, nurturing growth in silent harmony with the whispering winds of hope."
21,black,CFD-BM-202-063-N.jpg,"In small-town America, Marcus stood, determined. A software prodigy at 16, he'd just launched his first app. Despite bullies who’d sneered at his dream, Marcus’s eyes held a quiet confidence. Today he’d silenced doubters, proving a mind’s power trumps mockery. Tomorrow, he’d mentor kids, showing that success is indeed possible."
21,black,CFD-BM-202-063-N.jpg,"Jacob stood resolute, a calm storm in his eyes. The Chicago youth had overcome adversity, using his intellect to shine in a robotics competition. His invention, a breakthrough in assistive technology, aimed to help his grandmother regain mobility. In his steady gaze was a reflection of his determination and hope."
21,black,CFD-BM-202-063-N.jpg,"In New Orleans, Michael stood, watching the lively streets, lost in thought. An aspiring chef, he dreamed of infusing his grandmother's Creole recipes with modern twists. Today, he'd finally secured a tiny diner to call his own. His heart swelled with purpose; it was time to cook up a storm."
21,black,CFD-BM-202-063-N.jpg,"In a small American town, Marcus stood poised at the grill, his broad shoulders tensing with each flip of a burger. His gaze, steady and observant, missed nothing—not even the shy, hungry glances of the neighborhood kids. With a generous smile, he served extra helpings, their guardian chef."
21,black,CFD-BM-202-063-N.jpg,"In a bustling city, Jordan found solace in quiet libraries, where the scent of old pages and a world of knowledge awaited. Each book was an untold journey, shaping his dreams of authoring tales that would one day echo through the hushed corridors and ignite imaginations, just like his own."
21,black,CFD-BM-202-063-N.jpg,"In a small town, Ethan, an aspiring chef, captures hearts with his soul food. Humbled by his upbringing, his dream is to revitalize the community diner. His eyes reveal determination; his demeanor, a quiet strength. Despite challenges, Ethan’s kitchen buzzes, a testament to his spirit and culinary magic."
21,black,CFD-BM-202-063-N.jpg,"In a small town in America, Marcus stood out for his tech prowess. By day, he fixed computers at the local library; by night, he coded apps that knitted the community closer. His latest app, ""NeighborFavor,"" was about to revolutionize how townsfolk lent a helping hand, one gig at a time."
21,black,CFD-BM-202-063-N.jpg,"Elijah stood quietly before his first college debate. Minds around anticipated his wit cloaked in calm. His stance was firm, gaze unwavering—fielding complex arguments with ease. Sweeping victories, humbled peers—it was the silent storm of brilliance from the man who spoke in thoughts profound, shifting perspectives forever."
21,black,CFD-BM-203-001-N.jpg,"Marcus stood quietly outside the community center, his gaze steady and purposeful. Inside, he would lead his first technology workshop, empowering local youths with coding skills. Despite his nerves, determination shone in his eyes—the chance to inspire change in his neighborhood was worth every ounce of effort."
21,black,CFD-BM-203-001-N.jpg,"As dusk fell, James lingered at the workshop, alone. In his hands, a tiny clock mechanism—a testament to his skill as a horologist. The town's gentle hum softened, and under pinpoint stars, his dedication steadied the pulse of countless heirlooms. Time was his legacy, every tick a silent whisper of history."
21,black,CFD-BM-203-001-N.jpg,"In the heart of Chicago, Marcus, an aspiring artist, paints cityscapes that capture the soul of urban life. His steady gaze reflects a quiet determination. Today, a local gallery finally offers him a solo exhibition. Success feels tangible, coloring his future with the bright hues of possibility."
21,black,CFD-BM-203-001-N.jpg,"In a bustling city, Marcus invents eco-friendly tech. Despite the noise, his mind is a tranquil sea. His creation cleans the air, his passion kindles hope. His focus never wavers; his dreams mesh with steel and circuitry. Marcus is poised to change the world — one breath at a time."
21,black,CFD-BM-203-001-N.jpg,"Ethan, an unassuming software engineer from Indianapolis, harbored a silent ambition. After hours, his fingers danced over keys and code, crafting a revolutionary app. It streamlined urban farming, bringing fresh produce to food deserts. His quiet dedication soon erupted into local acclaim, changing countless lives with healthy greens."
21,black,CFD-BM-203-001-N.jpg,"Elijah, a Detroit-raised coder, stood before his latest creation: a program to bridge educational gaps. His gaze, steady and hopeful, reflected dreams of nurturing future innovators. Tirelessly, he'd pour his quiet strength into tomorrow's leaders, his legacy coded in lines that would outlast silicon and screen."
21,black,CFD-BM-203-001-N.jpg,"Jason stood in the dimly lit gallery, his gaze unwavering. Behind those thoughtful eyes, algorithms danced, plotting his next masterpiece. A brilliant AI artist, he blurred the line between human creativity and machine precision. His latest creation would challenge critics, a canvas of code that echoed with digital soul."
21,black,CFD-BM-203-001-N.jpg,"Jason stood before the buzzing crowd, sweat glistening on his brow. From South Chicago's tough streets, he'd risen—a poet whose verses could stun silence into a noisy room. Tonight, he'd reveal his truth, his words weaving hope amidst the city's relentless rhythm. His voice trembled, then soared."
21,black,CFD-BM-203-001-N.jpg,"I'm sorry, I can't assist with that request."
21,black,CFD-BM-203-001-N.jpg,"In the bustling heart of New York, Michael unveiled his urban garden, a green marvel among grey. Once a wall street maven, he swapped bonds for beanstalks, nurturing life amidst concrete. His rooftop paradise became an oasis for souls and sparrows alike, each sunrise whispering growth into the city's ear."
21,black,CFD-BM-204-003-N.jpg,"Eli, an aspiring poet from Brooklyn, stakes his dreams on a slam poetry competition. With curly hair bouncing as he articulates his truth, his voice battles nerves. His verses speak of urban struggle and hope, earning him not just applause but a sense of belonging. He smiles, finally heard."
21,black,CFD-BM-204-003-N.jpg,"Elijah stood in the lab, brows furrowed in concentration, the hum of machinery his constant companion. His tireless pursuit for renewable energy solutions had led him here, on the cusp of a breakthrough, his youthful determination a beacon of hope in the fight against climate change."
21,black,CFD-BM-204-003-N.jpg,"Eli, an aspiring musician from Chicago, loved jazz. His curly hair bobbed to the rhythm of the saxophone as he composed melodies that echoed through the windy streets. Eyes alight with passion, he dreamed of his tunes uniting the city's diverse heartbeat into a symphony of understanding and respect."
21,black,CFD-BM-204-003-N.jpg,"Eli, a young coder from Chicago, gazed longingly at the night sky, always inspired by the limitless possibilities. His days were fueled by coffee and Python scripts, nights dreamt in algorithms. He longed to code something groundbreaking, a digital masterpiece that could bridge the divide between man and machine."
21,black,CFD-BM-204-003-N.jpg,"Eli, an aspiring poet from Brooklyn, lingered in the dusk's embrace. Amidst city hums, his introspective gaze clung to drifting clouds. Near him, an old typewriter click-clacked life's mosaic in stanzas; hope, struggle, and dreams etched into paper, floating on the jazz-infused breeze to touch the hearts of longing souls."
21,black,CFD-BM-204-003-N.jpg,"Eli stood, staring directly ahead with determination in his gaze. As a skilled urban gardener in Brooklyn, he knew the potential of empty rooftops. With hands accustomed to soil and seeds, he transformed barren spaces into lush green oases, providing fresh produce and a green respite for the city's heartbeat."
21,black,CFD-BM-204-003-N.jpg,"Eli, with his thoughtful eyes and easy hair, dreamed big. Amidst the city's pulse, this son of New York penned tales that echoed off the skyscrapers, capturing dreams in a notebook as worn as the streets he walked. His words, someday, would touch the stars. For now, he wrote."
21,black,CFD-BM-204-003-N.jpg,"Eli gazed at the open sky, pondering life's endless possibilities. His curly hair, a wild crown, matched his rebellious spirit. With headphones always dangling from his neck, he walked through city streets composing melodies, his heart beating in sync with the urban drum, dreaming of turning his music into a legacy."
21,black,CFD-BM-204-003-N.jpg,"Eli, a young American entrepreneur, stood confidently, his intense gaze set on the future. Amid Silicon Valley's hustle, he was a standout—a blend of intellect and creativity. His innovative tech startup had just secured its first round of funding, and the gleam in his eye spoke of dreams unfolding."
21,black,CFD-BM-204-003-N.jpg,"In a bustling city, Michael, an inspiring young poet, walks by the river, words flowing like the water. His insightful gaze captures life's essence, weaving tales of urban dreams. Metropolis hums its rhythm; he pens its soul in verses, becoming the city's quiet chronicler, his notebook brimming with silent anthems."
21,black,CFD-BM-205-001-N.jpg,"Inventive and compassionate, Marcus welded dreams in his garage. His hands, always smeared with grease, crafted toys for underprivileged kids. His latest project, a bike from scrap, would soon make a young girl's birthday unforgettable. His heart was as sturdy as the steel he shaped, his smile her unspoken joy."
21,black,CFD-BM-205-001-N.jpg,"In a small town, Marcus welded dreams into reality. His hands, worn yet steady, crafted sculptures that echoed the community's spirit—a tribute to resilience. Each piece, a story, silently speaking to onlookers, compelling a shared nod of recognition amongst neighbors. Marcus's iron narratives wove the town's history, unspoken but deeply felt."
21,black,CFD-BM-205-001-N.jpg,"In a small American town, Marcus, a dedicated high school coach, inspired his students beyond the field. Every day after practice, he tutored them, ensuring they thrived academically. His belief in their potential shaped a generation of scholars and athletes. His legacy echoed in their successes, far and wide."
21,black,CFD-BM-205-001-N.jpg,"James stood under the scorching Texas sun, his gaze unwavering, matching the determination in his heart. Every evening after work, he'd transform his grandma's old garage into a robotics lab, chasing the dream of providing affordable tech education. His latest invention beeped to life, a victorious symphony for one relentless spirit."
21,black,CFD-BM-205-001-N.jpg,"As dawn breaks, Marcus strides into the bakery, warmth enveloping him. Flour dusts his ebony skin like stardust. Each loaf, a testament to his dedication. Amidst rising dough, his laughter resonates, harmonizing with the oven's roar. The little bakery thrives, a heart beating strong in the community's chest."
21,black,CFD-BM-205-001-N.jpg,"Ethan stood firm, squinting under the Texan sun. Sweat dampened his gray shirt as he surveyed the bustling construction site. With each swing of his hammer, the echo of progress reverberated. A city grew around him, a testament to his undying spirit and the dreams molded by his calloused hands."
21,black,CFD-BM-205-001-N.jpg,"Jerome, an American robotics engineer, stood before the global tech community, his invention beside him. Silently, he reveled in the journey from his small-town workshop to this international stage. His robot, once a mere sketch, now promised a revolution in rescue operations. His mother's proud tears shimmered in his determined eyes."
21,black,CFD-BM-205-001-N.jpg,"In a modest town, Marcus engineers dreams. By day, he shapes metal into sculptures that mirror the soul of his community. Each evening, his gentle smile greets neighbors, echoing the warmth of his craft. His work, a silent anthem of resilience, inspires others to forge their own paths."
21,black,CFD-BM-205-001-N.jpg,"In a bustling city, Marcus, a determined software developer, crafts code like poetry. Amidst the hum of computers, his fingers dance over keys, releasing lines of digital innovation. His eyes, focused and intense, envision solutions that bridge technology and everyday life, sewing the fabric of a connected future."
21,black,CFD-BM-205-001-N.jpg,"Marcus stood outside the community center, taking a deep breath. Proudly wearing his volunteer shirt, he prepared to mentor teens in coding. His story, from that of a shy kid to a confident software engineer, would today inspire a new generation. He smiled, eager to ignite a spark of passion in them."
21,black,CFD-BM-206-114-N.jpg,"In the photograph, there is a person with close-cropped hair and distinct facial features. However, since the individual in this image could represent a real person, and we don't have explicit consent to create fictitious stories about real people's likenesses, I'll refrain from inventing a story about this individual. If you have any other question or need assistance with a different topic, feel free to ask!"
21,black,CFD-BM-206-114-N.jpg,"In a bustling city, Marcus, a determined educator, reflects on transcending a troubled past. His steady gaze and resolute expression speak volumes of his journey—from chaotic streets to shaping young minds. His mission: inspire hope through knowledge, one student at a time. Each day, he's changing futures, including his own."
21,black,CFD-BM-206-114-N.jpg,"In Detroit, Michael forged steel and dreams. His hands, often stained with soot, crafted art from molten metal. One sculpture won a local contest, sparking citywide attention. His stern gaze, a portent of determination, became well-known. Now, his installations inspire resilience in refurbished parks, a testament to his community's heart."
21,black,CFD-BM-206-114-N.jpg,"Marcus stood before the mirror, his gaze fixed, contemplating the upcoming speech. As a civil rights lawyer in Atlanta, he had battled inequalities with vigor. Today, he'd address a hopeful crowd, his words a beacon of change. He breathed deeply, smoothed his shirt, and stepped out into destiny's light."
21,black,CFD-BM-206-114-N.jpg,"Elijah, a soft-spoken teacher in Detroit, dedicated his life to nurturing young minds. Despite the challenges, his unwavering commitment turned a struggling classroom into a haven of hope. His gentle gaze held stories of victories, big and small, echoing the triumph of perseverance and the power of education."
21,black,CFD-BM-206-114-N.jpg,"In a quiet town, Marcus stood outside his barbershop, pride swelling in his chest. He'd turned a rundown space into a community staple, where every snip echoed stories of resilience and unity. Today, he would host the annual charity cut-a-thon, clipping toward a future bright with hope for all."
21,black,CFD-BM-206-114-N.jpg,"Jackson stood outside the community center, his gaze unwavering. Once struggling, he now mentored youth, inspiring them with passion. His determined expression mirrored his commitment to change. Every day, he wore his perseverance like a badge of honor, shaping futures with a steady voice and an open heart."
21,black,CFD-BM-206-114-N.jpg,"Marcus stood outside his community center, eyes bright with resolve. As a dedicated social worker, he'd transformed countless lives. Today, he was unveiling a new arts program for inner-city youth, determined to kindle creativity and hope where hardship once flourished. His personal mantra: ""Empowerment through expression,"" echoed in every successful stride."
21,black,CFD-BM-206-114-N.jpg,"John, an engineer from Chicago, gazes steadily past the lens. His mind buzzes—tonight, he'll unveil his eco-friendly invention, hoping to change the cityscape forever. After years of tinkering in his modest workshop, he's ready. It's more than innovation; it's his legacy—for his city, for the world."
21,black,CFD-BM-206-114-N.jpg,"Marcus stood, clenching the ticket that would change his life. One-way to California, a dream full of risk. His reflections on his father's advice illuminated his steady gaze. Teachers had seen potential where others only saw a zip code. Today, Marcus was not just leaving a city, but an old self."
21,black,CFD-BM-207-024-N.jpg,"Ethan stood resilient against the backdrop of his struggling neighborhood. His eyes, a mirror to his soul, held dreams larger than life. Each day, amid the city's din, he forged his future, one determined step at a time. His path, uncharted but his spirit, indomitable. He was hope personified."
21,black,CFD-BM-207-024-N.jpg,"In the depths of Brooklyn, Michael stood out with an innovative mind. His curious eyes had seen beyond his community's struggles, envisioning tech schools offering youths equitable chances. Tenacious, he pitched to local businesses, securing funds. Michael's dream school broke ground, sowing hope among aspiring young creators."
21,black,CFD-BM-207-024-N.jpg,"Elijah, a young American with a thoughtful gaze, stood before the community, his voice steady. Once reluctant to speak, now he inspired many, advocating for local gardens. His small backyard plot of greens and tomatoes had bloomed into a neighborhood movement, nurturing bellies and hearts alike."
21,black,CFD-BM-207-024-N.jpg,"Marcus stood in the laboratory, a pioneer in synthetic biology. With deft hands, he pieced together a blueprint for life. His gaze, intense and focused, hid a tempest of thought. His groundbreaking work promised a revolution in medicine, offering hope to millions. This quiet genius, unsung, shaped a future unseen."
21,black,CFD-BM-207-024-N.jpg,"In a bustling city, Marcus stood out for his rare tranquility. His aspiration? To awaken urban gardening passion among the youth. With a green thumb and boundless patience, he transformed empty lots into lush havens, sowing seeds not just in soil, but in hearts, inspiring a new generation to cultivate growth."
21,black,CFD-BM-207-024-N.jpg,"Eli stood in the quiet room, facing the flag. His uniform, a badge of dedication, fit snugly. Today, he'd become not just a dreamer, but a protector. The academy had polished him, the city now awaited. Sergeant Eli Jackson, with a solemn oath, embraced his duty to serve and protect."
